{
  "schemaVersion": "hengdian/1",
  "id": "b0ed7bb3-1fb3-45de-bdf2-7a27a9b9ad6a",
  "name": "午后交接",
  "revision": 3,
  "fps": "24",
  "aspect": "16:9",
  "environment": "courtyard",
  "packVersion": "1.0.0",
  "entities": [
    {
      "id": "d101f4c3-3d3d-4206-bf95-590fbbc11a98",
      "name": "来客 A · 暖橙",
      "kind": "actor",
      "color": "#d96832",
      "transform": {
        "position": [
          -4,
          0,
          3
        ],
        "rotation": [
          0,
          0.7071067811865476,
          0,
          0.7071067811865476
        ],
        "scale": [
          1,
          1,
          1
        ]
      },
      "locked": false
    },
    {
      "id": "dc0ed7c0-0850-4017-a4ae-a17814fdf643",
      "name": "等候者 B · 蓝",
      "kind": "actor",
      "color": "#286bb8",
      "transform": {
        "position": [
          1.2,
          0,
          3
        ],
        "rotation": [
          0,
          -0.7071067811865476,
          0,
          0.7071067811865476
        ],
        "scale": [
          1,
          1,
          1
        ]
      },
      "locked": false
    },
    {
      "id": "338ad030-4fd3-4de6-82b1-8d9d091835ac",
      "name": "交接小桌",
      "kind": "table",
      "color": "#a0896b",
      "transform": {
        "position": [
          0,
          0,
          3
        ],
        "rotation": [
          0,
          0,
          0,
          1
        ],
        "scale": [
          0.85,
          1,
          0.85
        ]
      },
      "locked": false
    },
    {
      "id": "c40fe118-21ef-4d87-9be5-3007828b2ccb",
      "name": "绿植",
      "kind": "plant",
      "color": "#69806a",
      "transform": {
        "position": [
          -3.3,
          0,
          -2.3
        ],
        "rotation": [
          0,
          0,
          0,
          1
        ],
        "scale": [
          1,
          1,
          1
        ]
      },
      "locked": false
    },
    {
      "id": "handoff_box",
      "name": "待交付 · 黄色小盒",
      "kind": "box",
      "color": "#ffc429",
      "transform": {
        "position": [
          0,
          0.82,
          3
        ],
        "rotation": [
          0,
          0,
          0,
          1
        ],
        "scale": [
          0.36,
          0.25,
          0.3
        ]
      },
      "locked": false
    }
  ],
  "shots": [
    {
      "id": "a925d3b9-370b-472b-a139-b3bdfb57e256",
      "name": "01 · 庭院来客",
      "duration": 3,
      "camera": {
        "from": [
          1,
          3.3,
          13
        ],
        "to": [
          0.7,
          3.1,
          12.5
        ],
        "target": [
          -1,
          1,
          3
        ],
        "targetEnd": [
          -1,
          1,
          3
        ],
        "fov": 44,
        "follow": null
      },
      "tracks": {
        "d101f4c3-3d3d-4206-bf95-590fbbc11a98": [
          {
            "position": [
              -4,
              0,
              3
            ],
            "rotation": [
              0,
              0.7071067811865476,
              0,
              0.7071067811865476
            ],
            "scale": [
              1,
              1,
              1
            ],
            "time": 0
          },
          {
            "position": [
              -2.5,
              0,
              3
            ],
            "rotation": [
              0,
              0.7071067811865476,
              0,
              0.7071067811865476
            ],
            "scale": [
              1,
              1,
              1
            ],
            "time": 3
          }
        ]
      },
      "intent": "全景建立庭院：暖橙 A 左向右靠近；蓝 B 在桌右等候。保持会面轴线南侧。"
    },
    {
      "id": "dc6b39ee-f0bf-40ed-aeea-9130cfecde87",
      "name": "02 · 桌边会面",
      "duration": 4,
      "camera": {
        "from": [
          -0.55,
          1.35,
          8.5
        ],
        "to": [
          -0.25,
          1.35,
          7.7
        ],
        "target": [
          -0.65,
          1.15,
          3
        ],
        "targetEnd": [
          0,
          1.15,
          3
        ],
        "fov": 38,
        "follow": null
      },
      "tracks": {
        "d101f4c3-3d3d-4206-bf95-590fbbc11a98": [
          {
            "position": [
              -2.5,
              0,
              3
            ],
            "rotation": [
              0,
              0.7071067811865476,
              0,
              0.7071067811865476
            ],
            "scale": [
              1,
              1,
              1
            ],
            "time": 0
          },
          {
            "position": [
              -1.2,
              0,
              3
            ],
            "rotation": [
              0,
              0.7071067811865476,
              0,
              0.7071067811865476
            ],
            "scale": [
              1,
              1,
              1
            ],
            "time": 3
          },
          {
            "position": [
              -1.2,
              0,
              3
            ],
            "rotation": [
              0,
              0.7071067811865476,
              0,
              0.7071067811865476
            ],
            "scale": [
              1,
              1,
              1
            ],
            "time": 4
          }
        ]
      },
      "intent": "中景接续 A 上镜末位置，匀速白模平移到桌左，3秒到位后停顿；双方相向。不是骨骼步态。"
    },
    {
      "id": "88a5d089-d4b0-423e-b183-ba33c4f1ec73",
      "name": "03 · 即将交付",
      "duration": 3,
      "camera": {
        "from": [
          0.2,
          2.3,
          7.6
        ],
        "to": [
          0.1,
          2.05,
          6.8
        ],
        "target": [
          0,
          1.05,
          3
        ],
        "targetEnd": [
          0,
          1.03,
          3
        ],
        "fov": 38,
        "follow": null
      },
      "tracks": {
        "d101f4c3-3d3d-4206-bf95-590fbbc11a98": [
          {
            "position": [
              -1.2,
              0,
              3
            ],
            "rotation": [
              0,
              0.7071067811865476,
              0,
              0.7071067811865476
            ],
            "scale": [
              1,
              1,
              1
            ],
            "time": 0
          },
          {
            "position": [
              -1.2,
              0,
              3
            ],
            "rotation": [
              0,
              0.7071067811865476,
              0,
              0.7071067811865476
            ],
            "scale": [
              1,
              1,
              1
            ],
            "time": 3
          }
        ]
      },
      "intent": "双人关系收束，缓慢推进略俯看黄色小盒；两人留在盒子左右，表达交付前的停顿，无抓取。"
    }
  ],
  "notes": []
}
